{"items":[{"urn":"8","title":"Statement given by Valarie KOWALSKI on 01/02/2019","dateTaken":"2019-02-01T00:00:00","timeTaken":"13:10","reviewPeriod":"6 Weeks","reviewDate":"2019-03-15T00:00:00","dateCreated":"2019-09-09T14:20:07.01","createdBy":"Smart","_links":{"self":{"href":"/statements/219"}}},{"urn":"9","title":"Statement given by Linda BAGINSKI on 17/05/2019","dateTaken":"2019-05-17T00:00:00","timeTaken":"06:50","reviewPeriod":"3 Months","reviewDate":"2019-08-17T00:00:00","dateCreated":"2019-09-09T14:20:07.073","createdBy":"Davis","_links":{"self":{"href":"/statements/220"}}},{"urn":"10","title":"Statement given by Horace JONSSON on 17/05/2019","dateTaken":"2019-05-17T00:00:00","timeTaken":"11:30","reviewPeriod":"6 Months","reviewDate":"2019-11-17T00:00:00","dateCreated":"2019-09-09T14:20:07.107","createdBy":"Smart","_links":{"self":{"href":"/statements/221"}}},{"urn":"11","title":"Statement given by Marianne ANDREASSEN on 02/02/2019","dateTaken":"2019-02-02T00:00:00","timeTaken":"13:10","reviewPeriod":"2 Months","reviewDate":"2019-04-02T00:00:00","dateCreated":"2019-09-09T14:20:07.14","createdBy":"Mills","_links":{"self":{"href":"/statements/222"}}},{"urn":"12","title":"Statement given by Alberto WILD on 02/03/2019","dateTaken":"2019-03-02T00:00:00","timeTaken":"15:10","reviewPeriod":"4 Days","reviewDate":"2019-03-06T00:00:00","dateCreated":"2019-09-09T14:20:07.173","createdBy":"Davis","_links":{"self":{"href":"/statements/223"}}},{"urn":"13","title":"Statement given by Jolyon VEITCH on 17/05/2019","dateTaken":"2019-05-17T00:00:00","timeTaken":"13:00","reviewPeriod":"4 Days","reviewDate":"2019-05-21T00:00:00","dateCreated":"2019-09-09T14:20:07.207","createdBy":"Davis","_links":{"self":{"href":"/statements/224"}}},{"urn":"14","title":"Statement given by Aubrey CHOUDHURY on 29/04/2019","dateTaken":"2019-04-29T00:00:00","timeTaken":"15:00","reviewPeriod":"5 Days","reviewDate":"2019-05-04T00:00:00","dateCreated":"2019-09-09T14:20:07.24","createdBy":"Rees","_links":{"self":{"href":"/statements/225"}}},{"urn":"15","title":"Statement given by Dale CARLSSON on 19/04/2019","dateTaken":"2019-04-19T00:00:00","timeTaken":"17:40","reviewPeriod":"3 Years","reviewDate":"2022-04-19T00:00:00","dateCreated":"2019-09-09T14:20:07.27","createdBy":"Mills","_links":{"self":{"href":"/statements/226"}}},{"urn":"16","title":"Statement given by Dorothy BRYDON on 22/03/2019","dateTaken":"2019-03-22T00:00:00","timeTaken":"07:30","reviewPeriod":"4 Days","reviewDate":"2019-03-26T00:00:00","dateCreated":"2019-09-09T14:20:07.303","createdBy":"Cooper","_links":{"self":{"href":"/statements/227"}}},{"urn":"17","title":"Statement given by Etilan MELVIN on 04/02/2019","dateTaken":"2019-02-04T00:00:00","timeTaken":"16:00","reviewPeriod":"4 Months","reviewDate":"2019-06-04T00:00:00","dateCreated":"2019-09-09T14:20:07.337","createdBy":"Davis","_links":{"self":{"href":"/statements/228"}}},{"urn":"18","title":"Statement given by Alberto WILD on 03/03/2019","dateTaken":"2019-03-03T00:00:00","timeTaken":"08:40","reviewPeriod":"3 Months","reviewDate":"2019-06-03T00:00:00","dateCreated":"2019-09-09T14:20:07.37","createdBy":"Davis","_links":{"self":{"href":"/statements/229"}}},{"urn":"19","title":"Statement given by Graeme BARNES on 03/02/2019","dateTaken":"2019-02-03T00:00:00","timeTaken":"17:00","reviewPeriod":"4 Months","reviewDate":"2019-06-03T00:00:00","dateCreated":"2019-09-09T14:20:07.403","createdBy":"Davis","_links":{"self":{"href":"/statements/230"}}},{"urn":"20","title":"Statement given by Nosheen OREILLY on 22/03/2019","dateTaken":"2019-03-22T00:00:00","timeTaken":"12:00","reviewPeriod":"4 Months","reviewDate":"2019-07-22T00:00:00","dateCreated":"2019-09-09T14:20:07.433","createdBy":"Cooper","_links":{"self":{"href":"/statements/231"}}},{"urn":"21","title":"Statement given by Vikram BARBER on 22/03/2019","dateTaken":"2019-03-22T00:00:00","timeTaken":"12:20","reviewPeriod":"5 Weeks","reviewDate":"2019-04-26T00:00:00","dateCreated":"2019-09-09T14:20:07.467","createdBy":"Cooper","_links":{"self":{"href":"/statements/232"}}},{"urn":"22","title":"Statement given by Suzanne INGHAM on 03/02/2019","dateTaken":"2019-02-03T00:00:00","timeTaken":"06:50","reviewPeriod":"5 Years","reviewDate":"2024-02-03T00:00:00","dateCreated":"2019-09-09T14:20:07.5","createdBy":"Mills","_links":{"self":{"href":"/statements/233"}}},{"urn":"23","title":"Statement given by Justin SMITH on 13/04/2019","dateTaken":"2019-04-13T00:00:00","timeTaken":"13:40","reviewPeriod":"6 Years","reviewDate":"2025-04-13T00:00:00","dateCreated":"2019-09-09T14:20:07.537","createdBy":"Smart","_links":{"self":{"href":"/statements/234"}}},{"urn":"24","title":"Statement given by Suzanne GRAHAM on 13/04/2019","dateTaken":"2019-04-13T00:00:00","timeTaken":"09:30","reviewPeriod":"2 Days","reviewDate":"2019-04-15T00:00:00","dateCreated":"2019-09-09T14:20:07.573","createdBy":"Palmer","_links":{"self":{"href":"/statements/235"}}},{"urn":"25","title":"Statement given by Suzanne GRAHAM on 02/03/2019","dateTaken":"2019-03-02T00:00:00","timeTaken":"08:10","reviewPeriod":"5 Months","reviewDate":"2019-08-02T00:00:00","dateCreated":"2019-09-09T14:20:07.607","createdBy":"Smart","_links":{"self":{"href":"/statements/236"}}},{"urn":"26","title":"Statement given by Toby OREILLY on 03/03/2019","dateTaken":"2019-03-03T00:00:00","timeTaken":"11:10","reviewPeriod":"1 Year","reviewDate":"2020-03-03T00:00:00","dateCreated":"2019-09-09T14:20:07.64","createdBy":"Owen","_links":{"self":{"href":"/statements/237"}}},{"urn":"27","title":"Statement given by Emma BERNARD on 04/02/2019","dateTaken":"2019-02-04T00:00:00","timeTaken":"18:50","reviewPeriod":"3 Days","reviewDate":"2019-02-07T00:00:00","dateCreated":"2019-09-09T14:20:07.67","createdBy":"Rees","_links":{"self":{"href":"/statements/238"}}},{"urn":"28","title":"Statement given by Toby OREILLY on 29/04/2019","dateTaken":"2019-04-29T00:00:00","timeTaken":"15:10","reviewPeriod":"3 Days","reviewDate":"2019-05-02T00:00:00","type":"Transcript","dateCreated":"2019-09-09T14:20:07.7","createdBy":"Palmer","_links":{"self":{"href":"/statements/239"}}},{"urn":"29","title":"Statement given by Rachel ROY on 11/04/2019","dateTaken":"2019-04-11T00:00:00","timeTaken":"07:30","reviewPeriod":"4 Weeks","reviewDate":"2019-05-09T00:00:00","dateCreated":"2019-09-09T14:20:07.727","createdBy":"Davis","_links":{"self":{"href":"/statements/240"}}},{"urn":"30","title":"Statement given by Megan MCDOUGALL on 19/02/2019","dateTaken":"2019-02-19T00:00:00","timeTaken":"07:30","reviewPeriod":"4 Months","reviewDate":"2019-06-19T00:00:00","type":"Transcript","dateCreated":"2019-09-09T14:20:07.753","createdBy":"Singh","_links":{"self":{"href":"/statements/241"}}},{"urn":"31","title":"Statement given by Jason BHATIA on 17/05/2019","dateTaken":"2019-05-17T00:00:00","timeTaken":"07:10","reviewPeriod":"5 Days","reviewDate":"2019-05-22T00:00:00","dateCreated":"2019-09-09T14:20:07.78","createdBy":"Davis","_links":{"self":{"href":"/statements/242"}}},{"urn":"32","title":"Statement given by Wendy IRVINE on 29/04/2019","dateTaken":"2019-04-29T00:00:00","timeTaken":"08:40","reviewPeriod":"5 Months","reviewDate":"2019-09-29T00:00:00","dateCreated":"2019-09-09T14:20:07.81","createdBy":"Rees","_links":{"self":{"href":"/statements/243"}}},{"urn":"33","title":"Statement given by Roshni PALLETT on 06/05/2019","dateTaken":"2019-05-06T00:00:00","timeTaken":"07:40","reviewPeriod":"5 Months","reviewDate":"2019-10-06T00:00:00","dateCreated":"2019-09-09T14:20:07.84","createdBy":"Cooper","_links":{"self":{"href":"/statements/244"}}},{"urn":"34","title":"Statement given by Mackenzie PATTERSON on 19/04/2019","dateTaken":"2019-04-19T00:00:00","timeTaken":"17:30","reviewPeriod":"1 Month","reviewDate":"2019-05-19T00:00:00","dateCreated":"2019-09-09T14:20:07.87","createdBy":"Mills","_links":{"self":{"href":"/statements/245"}}},{"urn":"35","title":"Statement given by Hayden BERNARD on 04/02/2019","dateTaken":"2019-02-04T00:00:00","timeTaken":"07:50","reviewPeriod":"6 Months","reviewDate":"2019-08-04T00:00:00","type":"Transcript","dateCreated":"2019-09-09T14:20:07.9","createdBy":"Mills","_links":{"self":{"href":"/statements/246"}}},{"urn":"36","title":"Statement given by Ernest SUTTON on 22/03/2019","dateTaken":"2019-03-22T00:00:00","timeTaken":"18:50","reviewPeriod":"6 Days","reviewDate":"2019-03-28T00:00:00","dateCreated":"2019-09-09T14:20:07.93","createdBy":"Palmer","_links":{"self":{"href":"/statements/247"}}},{"urn":"37","title":"Statement given by Chloe LARSEN on 03/03/2019","dateTaken":"2019-03-03T00:00:00","timeTaken":"10:50","reviewPeriod":"6 Days","reviewDate":"2019-03-09T00:00:00","dateCreated":"2019-09-09T14:20:07.957","createdBy":"Mills","_links":{"self":{"href":"/statements/248"}}},{"urn":"38","title":"Statement given by Suzanne INGHAM on 13/04/2019","dateTaken":"2019-04-13T00:00:00","timeTaken":"07:10","reviewPeriod":"3 Weeks","reviewDate":"2019-05-04T00:00:00","dateCreated":"2019-09-09T14:20:07.99","createdBy":"Cooper","_links":{"self":{"href":"/statements/249"}}},{"urn":"39","title":"Statement given by Wayne BENBOW on 25/04/2019","dateTaken":"2019-04-25T00:00:00","timeTaken":"07:30","reviewPeriod":"2 Months","reviewDate":"2019-06-25T00:00:00","dateCreated":"2019-09-09T14:20:08.017","createdBy":"Walker","_links":{"self":{"href":"/statements/250"}}},{"urn":"40","title":"Statement given by Jane JEFFERSON on 14/05/2019","dateTaken":"2019-05-14T00:00:00","timeTaken":"14:40","reviewPeriod":"3 Years","reviewDate":"2022-05-14T00:00:00","dateCreated":"2019-09-09T14:20:08.043","createdBy":"Owen","_links":{"self":{"href":"/statements/251"}}},{"urn":"41","title":"Statement given by Suzanne INGHAM on 14/05/2019","dateTaken":"2019-05-14T00:00:00","timeTaken":"07:00","reviewPeriod":"3 Months","reviewDate":"2019-08-14T00:00:00","dateCreated":"2019-09-09T14:20:08.08","createdBy":"Walker","_links":{"self":{"href":"/statements/252"}}},{"urn":"42","title":"Statement given by Clare BORTHWICK on 08/03/2019","dateTaken":"2019-03-08T00:00:00","timeTaken":"18:40","reviewPeriod":"5 Months","reviewDate":"2019-08-08T00:00:00","dateCreated":"2019-09-09T14:20:08.113","createdBy":"Davis","_links":{"self":{"href":"/statements/253"}}},{"urn":"43","title":"Statement given by Ava HALL on 03/03/2019","dateTaken":"2019-03-03T00:00:00","timeTaken":"11:20","reviewPeriod":"4 Weeks","reviewDate":"2019-03-31T00:00:00","dateCreated":"2019-09-09T14:20:08.143","createdBy":"Singh","_links":{"self":{"href":"/statements/254"}}},{"urn":"44","title":"Statement given by Albert HEIR on 08/03/2019","dateTaken":"2019-03-08T00:00:00","timeTaken":"06:10","reviewPeriod":"5 Days","reviewDate":"2019-03-13T00:00:00","dateCreated":"2019-09-09T14:20:08.183","createdBy":"Palmer","_links":{"self":{"href":"/statements/255"}}},{"urn":"45","title":"Statement given by Tony QUIRK on 01/02/2019","dateTaken":"2019-02-01T00:00:00","timeTaken":"14:00","reviewPeriod":"1 Year","reviewDate":"2020-02-01T00:00:00","dateCreated":"2019-09-09T14:20:08.22","createdBy":"Rees","_links":{"self":{"href":"/statements/256"}}},{"urn":"46","title":"Statement given by Mason ATKINS on 03/02/2019","dateTaken":"2019-02-03T00:00:00","timeTaken":"13:20","reviewPeriod":"3 Years","reviewDate":"2022-02-03T00:00:00","type":"Transcript","dateCreated":"2019-09-09T14:20:08.25","createdBy":"Mills","_links":{"self":{"href":"/statements/257"}}},{"urn":"47","title":"Statement given by Edward ELLIS on 11/01/2019","dateTaken":"2019-01-11T00:00:00","timeTaken":"12:50","reviewPeriod":"3 Weeks","reviewDate":"2019-02-01T00:00:00","dateCreated":"2019-09-09T14:20:08.29","createdBy":"Davis","_links":{"self":{"href":"/statements/258"}}},{"urn":"48","title":"Statement given by Madison COLE on 07/01/2019","dateTaken":"2019-01-07T00:00:00","timeTaken":"16:10","reviewPeriod":"3 Days","reviewDate":"2019-01-10T00:00:00","dateCreated":"2019-09-09T14:20:08.323","createdBy":"Walker","_links":{"self":{"href":"/statements/259"}}},{"urn":"49","title":"Statement given by Diego CROMPTON on 03/02/2019","dateTaken":"2019-02-03T00:00:00","timeTaken":"16:10","reviewPeriod":"1 Week","reviewDate":"2019-02-10T00:00:00","type":"Transcript","dateCreated":"2019-09-09T14:20:08.36","createdBy":"Davis","_links":{"self":{"href":"/statements/260"}}},{"urn":"50","title":"Statement given by Ernest SUTTON on 02/02/2019","dateTaken":"2019-02-02T00:00:00","timeTaken":"11:10","reviewPeriod":"4 Weeks","reviewDate":"2019-03-02T00:00:00","dateCreated":"2019-09-09T14:20:08.403","createdBy":"Palmer","_links":{"self":{"href":"/statements/261"}}},{"urn":"51","title":"Statement given by Albert HEIR on 08/03/2019","dateTaken":"2019-03-08T00:00:00","timeTaken":"18:30","reviewPeriod":"1 Month","reviewDate":"2019-04-08T00:00:00","dateCreated":"2019-09-09T14:20:08.44","createdBy":"Davis","_links":{"self":{"href":"/statements/262"}}},{"urn":"52","title":"Statement given by Marcia ROBERTS on 22/03/2019","dateTaken":"2019-03-22T00:00:00","timeTaken":"10:00","reviewPeriod":"5 Days","reviewDate":"2019-03-27T00:00:00","dateCreated":"2019-09-09T14:20:08.48","createdBy":"Palmer","_links":{"self":{"href":"/statements/263"}}},{"urn":"53","title":"Statement given by Landon MANCINI on 25/04/2019","dateTaken":"2019-04-25T00:00:00","timeTaken":"15:30","reviewPeriod":"6 Years","reviewDate":"2025-04-25T00:00:00","dateCreated":"2019-09-09T14:20:08.523","createdBy":"Davis","_links":{"self":{"href":"/statements/264"}}},{"urn":"54","title":"Statement given by Louis OWENS on 02/03/2019","dateTaken":"2019-03-02T00:00:00","timeTaken":"13:50","reviewPeriod":"3 Months","reviewDate":"2019-06-02T00:00:00","dateCreated":"2019-09-09T14:20:08.59","createdBy":"Rees","_links":{"self":{"href":"/statements/265"}}},{"urn":"55","title":"Statement given by Madison COLE on 29/04/2019","dateTaken":"2019-04-29T00:00:00","timeTaken":"18:40","reviewPeriod":"6 Days","reviewDate":"2019-05-05T00:00:00","dateCreated":"2019-09-09T14:20:08.633","createdBy":"Singh","_links":{"self":{"href":"/statements/266"}}},{"urn":"56","title":"Statement given by Andrew PATEL on 22/03/2019","dateTaken":"2019-03-22T00:00:00","timeTaken":"16:00","reviewPeriod":"5 Months","reviewDate":"2019-08-22T00:00:00","dateCreated":"2019-09-09T14:20:08.667","createdBy":"Owen","_links":{"self":{"href":"/statements/267"}}},{"urn":"57","title":"Statement given by Geoffrey ROUX on 06/05/2019","dateTaken":"2019-05-06T00:00:00","timeTaken":"18:30","reviewPeriod":"4 Weeks","reviewDate":"2019-06-03T00:00:00","dateCreated":"2019-09-09T14:20:08.7","createdBy":"Rees","_links":{"self":{"href":"/statements/268"}}},{"urn":"58","title":"Statement given by Malcolm COSSEY on 06/05/2019","dateTaken":"2019-05-06T00:00:00","timeTaken":"15:50","reviewPeriod":"1 Month","reviewDate":"2019-06-06T00:00:00","dateCreated":"2019-09-09T14:20:08.737","createdBy":"Mills","_links":{"self":{"href":"/statements/269"}}},{"urn":"59","title":"Statement given by Alyssa FLEMING on 10/02/2019","dateTaken":"2019-02-10T00:00:00","timeTaken":"10:20","reviewPeriod":"2 Months","reviewDate":"2019-04-10T00:00:00","dateCreated":"2019-09-09T14:20:08.77","createdBy":"Davis","_links":{"self":{"href":"/statements/270"}}},{"urn":"60","title":"Statement given by Logan BYRNE on 25/04/2019","dateTaken":"2019-04-25T00:00:00","timeTaken":"15:10","reviewPeriod":"3 Months","reviewDate":"2019-07-25T00:00:00","dateCreated":"2019-09-09T14:20:08.803","createdBy":"Mills","_links":{"self":{"href":"/statements/271"}}},{"urn":"61","title":"Statement given by Hayden BERNARD on 13/04/2019","dateTaken":"2019-04-13T00:00:00","timeTaken":"09:30","reviewPeriod":"6 Days","reviewDate":"2019-04-19T00:00:00","dateCreated":"2019-09-09T14:20:08.84","createdBy":"Owen","_links":{"self":{"href":"/statements/272"}}},{"urn":"62","title":"Statement given by Horace JONSSON on 03/03/2019","dateTaken":"2019-03-03T00:00:00","timeTaken":"12:30","reviewPeriod":"2 Years","reviewDate":"2021-03-03T00:00:00","dateCreated":"2019-09-09T14:20:08.88","createdBy":"Davis","_links":{"self":{"href":"/statements/273"}}},{"urn":"63","title":"Statement given by Malcolm COSSEY on 08/03/2019","dateTaken":"2019-03-08T00:00:00","timeTaken":"18:20","reviewPeriod":"5 Months","reviewDate":"2019-08-08T00:00:00","dateCreated":"2019-09-09T14:20:08.92","createdBy":"Davis","_links":{"self":{"href":"/statements/274"}}},{"urn":"64","title":"Statement given by Nevaeh COTTER on 19/04/2019","dateTaken":"2019-04-19T00:00:00","timeTaken":"16:00","reviewPeriod":"5 Months","reviewDate":"2019-09-19T00:00:00","dateCreated":"2019-09-09T14:20:08.953","createdBy":"Rees","_links":{"self":{"href":"/statements/275"}}},{"urn":"65","title":"Statement given by Scarlett IRELAND on 10/02/2019","dateTaken":"2019-02-10T00:00:00","timeTaken":"08:50","reviewPeriod":"3 Years","reviewDate":"2022-02-10T00:00:00","dateCreated":"2019-09-09T14:20:08.983","createdBy":"Singh","_links":{"self":{"href":"/statements/276"}}},{"urn":"66","title":"Statement given by Wenping BROCK on 10/02/2019","dateTaken":"2019-02-10T00:00:00","timeTaken":"09:30","reviewPeriod":"1 Week","reviewDate":"2019-02-17T00:00:00","dateCreated":"2019-09-09T14:20:09.023","createdBy":"Davis","_links":{"self":{"href":"/statements/277"}}},{"urn":"67","title":"Statement given by Nosheen OREILLY on 04/02/2019","dateTaken":"2019-02-04T00:00:00","timeTaken":"15:00","reviewPeriod":"1 Year","reviewDate":"2020-02-04T00:00:00","dateCreated":"2019-09-09T14:20:09.07","createdBy":"Owen","_links":{"self":{"href":"/statements/278"}}},{"urn":"68","title":"Statement given by Sophie BARKER on 25/04/2019","dateTaken":"2019-04-25T00:00:00","timeTaken":"14:20","reviewPeriod":"3 Years","reviewDate":"2022-04-25T00:00:00","dateCreated":"2019-09-09T14:20:09.14","createdBy":"Singh","_links":{"self":{"href":"/statements/279"}}},{"urn":"69","title":"Statement given by Sidney HAUGEN on 10/02/2019","dateTaken":"2019-02-10T00:00:00","timeTaken":"17:00","reviewPeriod":"5 Months","reviewDate":"2019-07-10T00:00:00","type":"Witness","dateCreated":"2019-09-09T14:20:09.197","createdBy":"Cooper","_links":{"self":{"href":"/statements/280"}}},{"urn":"70","title":"Statement given by Katharine M†LLER on 13/04/2019","dateTaken":"2019-04-13T00:00:00","timeTaken":"14:40","reviewPeriod":"3 Weeks","reviewDate":"2019-05-04T00:00:00","dateCreated":"2019-09-09T14:20:09.247","createdBy":"Davis","_links":{"self":{"href":"/statements/281"}}},{"urn":"71","title":"Statement given by Amelia KAMINSKI on 03/03/2019","dateTaken":"2019-03-03T00:00:00","timeTaken":"10:00","reviewPeriod":"5 Months","reviewDate":"2019-08-03T00:00:00","dateCreated":"2019-09-09T14:20:09.473","createdBy":"Davis","_links":{"self":{"href":"/statements/282"}}},{"urn":"72","title":"Statement given by Joanna BALL on 21/04/2019","dateTaken":"2019-04-21T00:00:00","timeTaken":"06:40","reviewPeriod":"6 Years","reviewDate":"2025-04-21T00:00:00","dateCreated":"2019-09-09T14:20:09.683","createdBy":"Mills","_links":{"self":{"href":"/statements/283"}}},{"urn":"73","title":"Statement given by Clare BORTHWICK on 02/02/2019","dateTaken":"2019-02-02T00:00:00","timeTaken":"18:40","reviewPeriod":"6 Years","reviewDate":"2025-02-02T00:00:00","dateCreated":"2019-09-09T14:20:09.89","createdBy":"Walker","_links":{"self":{"href":"/statements/284"}}},{"urn":"74","title":"Statement given by Sophie BARKER on 01/02/2019","dateTaken":"2019-02-01T00:00:00","timeTaken":"17:50","reviewPeriod":"6 Months","reviewDate":"2019-08-01T00:00:00","dateCreated":"2019-09-09T14:20:10.083","createdBy":"Singh","_links":{"self":{"href":"/statements/285"}}},{"urn":"75","title":"Statement given by Brooke SHARP on 21/04/2019","dateTaken":"2019-04-21T00:00:00","timeTaken":"10:00","reviewPeriod":"5 Days","reviewDate":"2019-04-26T00:00:00","dateCreated":"2019-09-09T14:20:10.26","createdBy":"Davis","_links":{"self":{"href":"/statements/286"}}},{"urn":"76","title":"Statement given by Judith HANSEN on 02/02/2019","dateTaken":"2019-02-02T00:00:00","timeTaken":"13:10","reviewPeriod":"3 Days","reviewDate":"2019-02-05T00:00:00","dateCreated":"2019-09-09T14:20:10.447","createdBy":"Davis","_links":{"self":{"href":"/statements/287"}}},{"urn":"77","title":"Statement given by Suhail FENWICK on 22/03/2019","dateTaken":"2019-03-22T00:00:00","timeTaken":"11:20","reviewPeriod":"2 Days","reviewDate":"2019-03-24T00:00:00","dateCreated":"2019-09-09T14:20:10.653","createdBy":"Rees","_links":{"self":{"href":"/statements/288"}}},{"urn":"78","title":"Statement given by Devin COWLEY on 11/04/2019","dateTaken":"2019-04-11T00:00:00","timeTaken":"07:40","reviewPeriod":"3 Months","reviewDate":"2019-07-11T00:00:00","dateCreated":"2019-09-09T14:20:10.87","createdBy":"Smart","_links":{"self":{"href":"/statements/289"}}},{"urn":"79","title":"Statement given by Toby OREILLY on 13/04/2019","dateTaken":"2019-04-13T00:00:00","timeTaken":"18:30","reviewPeriod":"3 Months","reviewDate":"2019-07-13T00:00:00","dateCreated":"2019-09-09T14:20:11.057","createdBy":"Owen","_links":{"self":{"href":"/statements/290"}}},{"urn":"80","title":"Statement given by Sidney HAUGEN on 01/02/2019","dateTaken":"2019-02-01T00:00:00","timeTaken":"18:20","reviewPeriod":"6 Years","reviewDate":"2025-02-01T00:00:00","dateCreated":"2019-09-09T14:20:11.273","createdBy":"Davis","_links":{"self":{"href":"/statements/291"}}},{"urn":"81","title":"Statement given by Nevaeh NILSEN on 19/04/2019","dateTaken":"2019-04-19T00:00:00","timeTaken":"09:10","reviewPeriod":"3 Days","reviewDate":"2019-04-22T00:00:00","dateCreated":"2019-09-09T14:20:11.457","createdBy":"Davis","_links":{"self":{"href":"/statements/292"}}},{"urn":"82","title":"Statement given by Edward ELLIS on 07/01/2019","dateTaken":"2019-01-07T00:00:00","timeTaken":"09:30","reviewPeriod":"4 Days","reviewDate":"2019-01-11T00:00:00","dateCreated":"2019-09-09T14:20:11.64","createdBy":"Rees","_links":{"self":{"href":"/statements/293"}}},{"urn":"83","title":"Statement given by Rachel ROY on 04/02/2019","dateTaken":"2019-02-04T00:00:00","timeTaken":"16:50","reviewPeriod":"1 Week","reviewDate":"2019-02-11T00:00:00","dateCreated":"2019-09-09T14:20:11.843","createdBy":"Davis","_links":{"self":{"href":"/statements/294"}}},{"urn":"84","title":"Statement given by Horace JONSSON on 10/02/2019","dateTaken":"2019-02-10T00:00:00","timeTaken":"11:40","reviewPeriod":"5 Weeks","reviewDate":"2019-03-17T00:00:00","dateCreated":"2019-09-09T14:20:12.047","createdBy":"Mills","_links":{"self":{"href":"/statements/295"}}},{"urn":"85","title":"Statement given by Brooke SHARP on 08/03/2019","dateTaken":"2019-03-08T00:00:00","timeTaken":"14:50","reviewPeriod":"6 Years","reviewDate":"2025-03-08T00:00:00","dateCreated":"2019-09-09T14:20:12.237","createdBy":"Mills","_links":{"self":{"href":"/statements/296"}}},{"urn":"86","title":"Statement given by Debra MCMENAMIN on 08/03/2019","dateTaken":"2019-03-08T00:00:00","timeTaken":"14:10","reviewPeriod":"3 Years","reviewDate":"2022-03-08T00:00:00","dateCreated":"2019-09-09T14:20:12.417","createdBy":"Palmer","_links":{"self":{"href":"/statements/297"}}},{"urn":"87","title":"Statement given by Jason BHATIA on 25/04/2019","dateTaken":"2019-04-25T00:00:00","timeTaken":"06:20","reviewPeriod":"1 Week","reviewDate":"2019-05-02T00:00:00","dateCreated":"2019-09-09T14:20:12.6","createdBy":"Mills","_links":{"self":{"href":"/statements/298"}}},{"urn":"88","title":"Statement given by Jayden BOOTH on 04/02/2019","dateTaken":"2019-02-04T00:00:00","timeTaken":"11:30","reviewPeriod":"6 Days","reviewDate":"2019-02-10T00:00:00","dateCreated":"2019-09-09T14:20:12.79","createdBy":"Walker","_links":{"self":{"href":"/statements/299"}}},{"urn":"89","title":"Statement given by Wendy BLACKWELL on 08/03/2019","dateTaken":"2019-03-08T00:00:00","timeTaken":"14:00","reviewPeriod":"3 Months","reviewDate":"2019-06-08T00:00:00","dateCreated":"2019-09-09T14:20:12.963","createdBy":"Rees","_links":{"self":{"href":"/statements/300"}}},{"urn":"90","title":"Statement given by Jason BHATIA on 10/02/2019","dateTaken":"2019-02-10T00:00:00","timeTaken":"18:00","reviewPeriod":"5 Weeks","reviewDate":"2019-03-17T00:00:00","dateCreated":"2019-09-09T14:20:13.153","createdBy":"Rees","_links":{"self":{"href":"/statements/301"}}},{"urn":"91","title":"Statement given by Stanley ROBERT on 25/04/2019","dateTaken":"2019-04-25T00:00:00","timeTaken":"09:00","reviewPeriod":"1 Month","reviewDate":"2019-05-25T00:00:00","dateCreated":"2019-09-09T14:20:13.357","createdBy":"Owen","_links":{"self":{"href":"/statements/302"}}},{"urn":"92","title":"Statement given by Ivana MURPHY on 29/04/2019","dateTaken":"2019-04-29T00:00:00","timeTaken":"15:40","reviewPeriod":"6 Weeks","reviewDate":"2019-06-10T00:00:00","dateCreated":"2019-09-09T14:20:13.533","createdBy":"Singh","_links":{"self":{"href":"/statements/303"}}},{"urn":"93","title":"Statement given by Devin COWLEY on 13/04/2019","dateTaken":"2019-04-13T00:00:00","timeTaken":"15:20","reviewPeriod":"4 Months","reviewDate":"2019-08-13T00:00:00","dateCreated":"2019-09-09T14:20:13.79","createdBy":"Walker","_links":{"self":{"href":"/statements/304"}}},{"urn":"94","title":"Statement given by Vikram BARBER on 02/02/2019","dateTaken":"2019-02-02T00:00:00","timeTaken":"09:10","reviewPeriod":"4 Weeks","reviewDate":"2019-03-02T00:00:00","dateCreated":"2019-09-09T14:20:13.99","createdBy":"Mills","_links":{"self":{"href":"/statements/305"}}},{"urn":"95","title":"Statement given by Renata MERCIER on 03/02/2019","dateTaken":"2019-02-03T00:00:00","timeTaken":"06:50","reviewPeriod":"2 Years","reviewDate":"2021-02-03T00:00:00","dateCreated":"2019-09-09T14:20:14.163","createdBy":"Walker","_links":{"self":{"href":"/statements/306"}}},{"urn":"96","title":"Statement given by Marcia ROBERTS on 03/03/2019","dateTaken":"2019-03-03T00:00:00","timeTaken":"17:20","reviewPeriod":"5 Months","reviewDate":"2019-08-03T00:00:00","dateCreated":"2019-09-09T14:20:14.337","createdBy":"Davis","_links":{"self":{"href":"/statements/307"}}},{"urn":"97","title":"Statement given by Benjamin MORETTI on 04/02/2019","dateTaken":"2019-02-04T00:00:00","timeTaken":"14:00","reviewPeriod":"1 Day","reviewDate":"2019-02-05T00:00:00","dateCreated":"2019-09-09T14:20:14.51","createdBy":"Rees","_links":{"self":{"href":"/statements/308"}}},{"urn":"98","title":"Statement given by Suzanne INGHAM on 11/01/2019","dateTaken":"2019-01-11T00:00:00","timeTaken":"08:50","reviewPeriod":"3 Months","reviewDate":"2019-04-11T00:00:00","dateCreated":"2019-09-09T14:20:14.69","createdBy":"Davis","_links":{"self":{"href":"/statements/309"}}},{"urn":"99","title":"Statement given by Wayne BENBOW on 22/03/2019","dateTaken":"2019-03-22T00:00:00","timeTaken":"15:20","reviewPeriod":"5 Weeks","reviewDate":"2019-04-26T00:00:00","dateCreated":"2019-09-09T14:20:14.867","createdBy":"Davis","_links":{"self":{"href":"/statements/310"}}},{"urn":"100","title":"Statement given by Manda HALFORD on 01/02/2019","dateTaken":"2019-02-01T00:00:00","timeTaken":"14:50","reviewPeriod":"3 Months","reviewDate":"2019-05-01T00:00:00","dateCreated":"2019-09-09T14:20:15.06","createdBy":"Mills","_links":{"self":{"href":"/statements/311"}}},{"urn":"101","title":"Statement given by Wendy IRVINE on 25/04/2019","dateTaken":"2019-04-25T00:00:00","timeTaken":"14:10","reviewPeriod":"6 Months","reviewDate":"2019-10-25T00:00:00","dateCreated":"2019-09-09T14:20:15.263","createdBy":"Davis","_links":{"self":{"href":"/statements/312"}}},{"urn":"102","title":"Statement given by Ava HALL on 14/05/2019","dateTaken":"2019-05-14T00:00:00","timeTaken":"08:20","reviewPeriod":"4 Years","reviewDate":"2023-05-14T00:00:00","dateCreated":"2019-09-09T14:20:15.453","createdBy":"Smart","_links":{"self":{"href":"/statements/313"}}},{"urn":"103","title":"Statement given by Christian VINCENT on 03/03/2019","dateTaken":"2019-03-03T00:00:00","timeTaken":"07:30","reviewPeriod":"2 Years","reviewDate":"2021-03-03T00:00:00","dateCreated":"2019-09-09T14:20:15.65","createdBy":"Singh","_links":{"self":{"href":"/statements/314"}}},{"urn":"104","title":"Statement given by Jaymes SHARP on 14/05/2019","dateTaken":"2019-05-14T00:00:00","timeTaken":"18:10","reviewPeriod":"1 Day","reviewDate":"2019-05-15T00:00:00","dateCreated":"2019-09-09T14:20:15.843","createdBy":"Davis","_links":{"self":{"href":"/statements/315"}}},{"urn":"105","title":"Statement given by Brooke SHARP on 02/02/2019","dateTaken":"2019-02-02T00:00:00","timeTaken":"15:40","reviewPeriod":"2 Months","reviewDate":"2019-04-02T00:00:00","dateCreated":"2019-09-09T14:20:16.113","createdBy":"Cooper","_links":{"self":{"href":"/statements/316"}}},{"urn":"106","title":"Statement given by Mackenzie PATTERSON on 08/03/2019","dateTaken":"2019-03-08T00:00:00","timeTaken":"09:00","reviewPeriod":"3 Months","reviewDate":"2019-06-08T00:00:00","dateCreated":"2019-09-09T14:20:16.303","createdBy":"Walker","_links":{"self":{"href":"/statements/317"}}},{"urn":"107","title":"Statement given by Linda BAGINSKI on 06/05/2019","dateTaken":"2019-05-06T00:00:00","timeTaken":"10:10","reviewPeriod":"1 Month","reviewDate":"2019-06-06T00:00:00","type":"Transcript","dateCreated":"2019-09-09T14:20:16.47","createdBy":"Rees","_links":{"self":{"href":"/statements/318"}}},{"urn":"108","title":"Statement given by Sophie BARKER on 14/05/2019","dateTaken":"2019-05-14T00:00:00","timeTaken":"14:20","reviewPeriod":"4 Weeks","reviewDate":"2019-06-11T00:00:00","dateCreated":"2019-09-09T14:20:16.64","createdBy":"Mills","_links":{"self":{"href":"/statements/319"}}},{"urn":"109","title":"Statement given by Ava HALL on 11/01/2019","dateTaken":"2019-01-11T00:00:00","timeTaken":"11:40","reviewPeriod":"4 Years","reviewDate":"2023-01-11T00:00:00","dateCreated":"2019-09-09T14:20:16.837","createdBy":"Mills","_links":{"self":{"href":"/statements/320"}}},{"urn":"110","title":"Statement given by Malcolm COSSEY on 19/04/2019","dateTaken":"2019-04-19T00:00:00","timeTaken":"12:10","reviewPeriod":"3 Months","reviewDate":"2019-07-19T00:00:00","dateCreated":"2019-09-09T14:20:17.017","createdBy":"Owen","_links":{"self":{"href":"/statements/321"}}},{"urn":"111","title":"Statement given by Toby OREILLY on 03/03/2019","dateTaken":"2019-03-03T00:00:00","timeTaken":"17:20","reviewPeriod":"2 Years","reviewDate":"2021-03-03T00:00:00","dateCreated":"2019-09-09T14:20:17.193","createdBy":"Singh","_links":{"self":{"href":"/statements/322"}}},{"urn":"112","title":"Statement given by Suhail FENWICK on 03/03/2019","dateTaken":"2019-03-03T00:00:00","timeTaken":"13:10","reviewPeriod":"1 Month","reviewDate":"2019-04-03T00:00:00","dateCreated":"2019-09-09T14:20:17.367","createdBy":"Cooper","_links":{"self":{"href":"/statements/323"}}},{"urn":"113","title":"Statement given by Jason BHATIA on 25/04/2019","dateTaken":"2019-04-25T00:00:00","timeTaken":"06:30","reviewPeriod":"4 Months","reviewDate":"2019-08-25T00:00:00","dateCreated":"2019-09-09T14:20:17.54","createdBy":"Davis","_links":{"self":{"href":"/statements/324"}}},{"urn":"114","title":"Statement given by Scarlett IRELAND on 03/02/2019","dateTaken":"2019-02-03T00:00:00","timeTaken":"13:10","reviewPeriod":"2 Months","reviewDate":"2019-04-03T00:00:00","dateCreated":"2019-09-09T14:20:17.727","createdBy":"Walker","_links":{"self":{"href":"/statements/325"}}},{"urn":"115","title":"Statement given by Stephen GALLAGHER on 22/03/2019","dateTaken":"2019-03-22T00:00:00","timeTaken":"10:00","reviewPeriod":"3 Days","reviewDate":"2019-03-25T00:00:00","dateCreated":"2019-09-09T14:20:17.923","createdBy":"Mills","_links":{"self":{"href":"/statements/326"}}},{"urn":"116","title":"Statement given by Roshni PALLETT on 02/02/2019","dateTaken":"2019-02-02T00:00:00","timeTaken":"17:20","reviewPeriod":"5 Weeks","reviewDate":"2019-03-09T00:00:00","dateCreated":"2019-09-09T14:20:18.127","createdBy":"Singh","_links":{"self":{"href":"/statements/327"}}},{"urn":"117","title":"Statement given by Alice JINKS on 01/02/2019","dateTaken":"2019-02-01T00:00:00","timeTaken":"17:20","reviewPeriod":"4 Months","reviewDate":"2019-06-01T00:00:00","dateCreated":"2019-09-09T14:20:18.327","createdBy":"Cooper","_links":{"self":{"href":"/statements/328"}}},{"urn":"118","title":"Statement given by Albert HEIR on 11/01/2019","dateTaken":"2019-01-11T00:00:00","timeTaken":"13:00","reviewPeriod":"3 Years","reviewDate":"2022-01-11T00:00:00","dateCreated":"2019-09-09T14:20:18.51","createdBy":"Rees","_links":{"self":{"href":"/statements/329"}}},{"urn":"119","title":"Statement given by Paula SCOTT on 19/04/2019","dateTaken":"2019-04-19T00:00:00","timeTaken":"17:40","reviewPeriod":"1 Year","reviewDate":"2020-04-19T00:00:00","dateCreated":"2019-09-09T14:20:18.69","createdBy":"Davis","_links":{"self":{"href":"/statements/330"}}},{"urn":"120","title":"Statement given by Malcolm COSSEY on 01/02/2019","dateTaken":"2019-02-01T00:00:00","timeTaken":"15:50","reviewPeriod":"5 Days","reviewDate":"2019-02-06T00:00:00","type":"Transcript","dateCreated":"2019-09-09T14:20:18.87","createdBy":"Mills","_links":{"self":{"href":"/statements/331"}}},{"urn":"121","title":"Statement given by Carolyn SHARPE on 03/02/2019","dateTaken":"2019-02-03T00:00:00","timeTaken":"11:30","reviewPeriod":"4 Months","reviewDate":"2019-06-03T00:00:00","dateCreated":"2019-09-09T14:20:19.057","createdBy":"Owen","_links":{"self":{"href":"/statements/332"}}},{"urn":"122","title":"Statement given by Alyssa SEATON on 08/03/2019","dateTaken":"2019-03-08T00:00:00","timeTaken":"10:40","reviewPeriod":"4 Days","reviewDate":"2019-03-12T00:00:00","dateCreated":"2019-09-09T14:20:19.243","createdBy":"Smart","_links":{"self":{"href":"/statements/333"}}},{"urn":"123","title":"Statement given by Etilan MELVIN on 22/03/2019","dateTaken":"2019-03-22T00:00:00","timeTaken":"18:50","reviewPeriod":"2 Years","reviewDate":"2021-03-22T00:00:00","dateCreated":"2019-09-09T14:20:19.46","createdBy":"Davis","_links":{"self":{"href":"/statements/334"}}},{"urn":"124","title":"Statement given by Suzanne INGHAM on 06/05/2019","dateTaken":"2019-05-06T00:00:00","timeTaken":"07:30","reviewPeriod":"2 Years","reviewDate":"2021-05-06T00:00:00","dateCreated":"2019-09-09T14:20:19.65","createdBy":"Palmer","_links":{"self":{"href":"/statements/335"}}},{"urn":"125","title":"Statement given by James SEATON on 25/04/2019","dateTaken":"2019-04-25T00:00:00","timeTaken":"18:40","reviewPeriod":"2 Months","reviewDate":"2019-06-25T00:00:00","dateCreated":"2019-09-09T14:20:19.85","createdBy":"Mills","_links":{"self":{"href":"/statements/336"}}},{"urn":"126","title":"Statement given by Hayden BERNARD on 17/05/2019","dateTaken":"2019-05-17T00:00:00","timeTaken":"07:40","reviewPeriod":"1 Month","reviewDate":"2019-06-17T00:00:00","dateCreated":"2019-09-09T14:20:20.06","createdBy":"Davis","_links":{"self":{"href":"/statements/337"}}},{"urn":"127","title":"Statement given by Manda HALFORD on 11/01/2019","dateTaken":"2019-01-11T00:00:00","timeTaken":"07:50","reviewPeriod":"6 Months","reviewDate":"2019-07-11T00:00:00","dateCreated":"2019-09-09T14:20:20.23","createdBy":"Rees","_links":{"self":{"href":"/statements/338"}}},{"urn":"128","title":"Statement given by Albert HEIR on 19/04/2019","dateTaken":"2019-04-19T00:00:00","timeTaken":"07:30","reviewPeriod":"5 Months","reviewDate":"2019-09-19T00:00:00","dateCreated":"2019-09-09T14:20:20.36","createdBy":"Davis","_links":{"self":{"href":"/statements/339"}}},{"urn":"129","title":"Statement given by Horace JONSSON on 21/04/2019","dateTaken":"2019-04-21T00:00:00","timeTaken":"12:20","reviewPeriod":"3 Months","reviewDate":"2019-07-21T00:00:00","dateCreated":"2019-09-09T14:20:20.527","createdBy":"Cooper","_links":{"self":{"href":"/statements/340"}}},{"urn":"130","title":"Statement given by Elijah BEGUM on 19/04/2019","dateTaken":"2019-04-19T00:00:00","timeTaken":"15:20","reviewPeriod":"6 Weeks","reviewDate":"2019-05-31T00:00:00","dateCreated":"2019-09-09T14:20:20.713","createdBy":"Mills","_links":{"self":{"href":"/statements/341"}}},{"urn":"131","title":"Statement given by Nevaeh NILSEN on 02/03/2019","dateTaken":"2019-03-02T00:00:00","timeTaken":"15:50","reviewPeriod":"1 Month","reviewDate":"2019-04-02T00:00:00","dateCreated":"2019-09-09T14:20:20.903","createdBy":"Mills","_links":{"self":{"href":"/statements/342"}}},{"urn":"132","title":"Statement given by Carolyn SHARPE on 22/03/2019","dateTaken":"2019-03-22T00:00:00","timeTaken":"18:20","reviewPeriod":"1 Week","reviewDate":"2019-03-29T00:00:00","dateCreated":"2019-09-09T14:20:21.093","createdBy":"Singh","_links":{"self":{"href":"/statements/343"}}},{"urn":"133","title":"Statement given by Dean PETTERSEN on 14/05/2019","dateTaken":"2019-05-14T00:00:00","timeTaken":"18:50","reviewPeriod":"6 Weeks","reviewDate":"2019-06-25T00:00:00","dateCreated":"2019-09-09T14:20:21.267","createdBy":"Rees","_links":{"self":{"href":"/statements/344"}}},{"urn":"135","title":"Statement given by Benjamin MORETTI on 08/03/2019","dateTaken":"2019-03-08T00:00:00","timeTaken":"18:10","reviewPeriod":"4 Years","reviewDate":"2023-03-08T00:00:00","dateCreated":"2019-09-09T14:20:21.62","createdBy":"Davis","_links":{"self":{"href":"/statements/346"}}},{"urn":"136","title":"Statement given by Rosalyn LOMBARDI on 17/05/2019","dateTaken":"2019-05-17T00:00:00","timeTaken":"12:40","reviewPeriod":"4 Months","reviewDate":"2019-09-17T00:00:00","dateCreated":"2019-09-09T14:20:21.793","createdBy":"Singh","_links":{"self":{"href":"/statements/347"}}},{"urn":"137","title":"Statement given by Mackenzie PATTERSON on 03/02/2019","dateTaken":"2019-02-03T00:00:00","timeTaken":"18:50","reviewPeriod":"2 Years","reviewDate":"2021-02-03T00:00:00","dateCreated":"2019-09-09T14:20:21.98","createdBy":"Rees","_links":{"self":{"href":"/statements/348"}}},{"urn":"138","title":"Statement given by Jayden BOOTH on 03/03/2019","dateTaken":"2019-03-03T00:00:00","timeTaken":"12:40","reviewPeriod":"3 Days","reviewDate":"2019-03-06T00:00:00","dateCreated":"2019-09-09T14:20:22.15","createdBy":"Cooper","_links":{"self":{"href":"/statements/349"}}},{"urn":"139","title":"Statement given by Isabella JOHNSON on 03/02/2019","dateTaken":"2019-02-03T00:00:00","timeTaken":"10:40","reviewPeriod":"5 Days","reviewDate":"2019-02-08T00:00:00","dateCreated":"2019-09-09T14:20:22.323","createdBy":"Walker","_links":{"self":{"href":"/statements/350"}}},{"urn":"140","title":"Statement given by Dean PETTERSEN on 25/04/2019","dateTaken":"2019-04-25T00:00:00","timeTaken":"10:00","reviewPeriod":"5 Days","reviewDate":"2019-04-30T00:00:00","dateCreated":"2019-09-09T14:20:22.503","createdBy":"Rees","_links":{"self":{"href":"/statements/351"}}},{"urn":"141","title":"Statement given by Clare BORTHWICK on 03/03/2019","dateTaken":"2019-03-03T00:00:00","timeTaken":"16:00","reviewPeriod":"6 Months","reviewDate":"2019-09-03T00:00:00","dateCreated":"2019-09-09T14:20:22.677","createdBy":"Davis","_links":{"self":{"href":"/statements/352"}}},{"urn":"142","title":"Statement given by Tony QUIRK on 03/03/2019","dateTaken":"2019-03-03T00:00:00","timeTaken":"13:50","reviewPeriod":"5 Years","reviewDate":"2024-03-03T00:00:00","dateCreated":"2019-09-09T14:20:22.857","createdBy":"Mills","_links":{"self":{"href":"/statements/353"}}},{"urn":"143","title":"Statement given by Wenping BROCK on 06/05/2019","dateTaken":"2019-05-06T00:00:00","timeTaken":"14:40","reviewPeriod":"5 Months","reviewDate":"2019-10-06T00:00:00","type":"Transcript","dateCreated":"2019-09-09T14:20:23.033","createdBy":"Mills","_links":{"self":{"href":"/statements/354"}}},{"urn":"144","title":"Statement given by Scarlett IRELAND on 03/03/2019","dateTaken":"2019-03-03T00:00:00","timeTaken":"10:10","reviewPeriod":"2 Days","reviewDate":"2019-03-05T00:00:00","dateCreated":"2019-09-09T14:20:23.21","createdBy":"Davis","_links":{"self":{"href":"/statements/355"}}},{"urn":"145","title":"Statement given by Roshni PALLETT on 08/03/2019","dateTaken":"2019-03-08T00:00:00","timeTaken":"14:50","reviewPeriod":"4 Months","reviewDate":"2019-07-08T00:00:00","dateCreated":"2019-09-09T14:20:23.393","createdBy":"Singh","_links":{"self":{"href":"/statements/356"}}},{"urn":"146","title":"Statement given by Paula SCOTT on 08/01/2019","dateTaken":"2019-01-08T00:00:00","timeTaken":"18:00","reviewPeriod":"4 Months","reviewDate":"2019-05-08T00:00:00","dateCreated":"2019-09-09T14:20:23.59","createdBy":"Davis","_links":{"self":{"href":"/statements/357"}}},{"urn":"147","title":"Statement given by Megan MCDOUGALL on 17/05/2019","dateTaken":"2019-05-17T00:00:00","timeTaken":"15:30","reviewPeriod":"1 Month","reviewDate":"2019-06-17T00:00:00","dateCreated":"2019-09-09T14:20:23.787","createdBy":"Mills","_links":{"self":{"href":"/statements/358"}}},{"urn":"148","title":"Statement given by Harold COLLINGS on 03/02/2019","dateTaken":"2019-02-03T00:00:00","timeTaken":"18:50","reviewPeriod":"2 Months","reviewDate":"2019-04-03T00:00:00","dateCreated":"2019-09-09T14:20:23.997","createdBy":"Smart","_links":{"self":{"href":"/statements/359"}}},{"urn":"149","title":"Statement given by Gerald OBRIEN on 07/01/2019","dateTaken":"2019-01-07T00:00:00","timeTaken":"13:20","reviewPeriod":"2 Months","reviewDate":"2019-03-07T00:00:00","dateCreated":"2019-09-09T14:20:24.18","createdBy":"Davis","_links":{"self":{"href":"/statements/360"}}}]}